{
  "$schema": "https://json-schema.org/draft/2020-12/schema",
  "title": "DCMS dental chart v2 transport snapshot",
  "description": "Shape, inventory and vocabulary validation only. Backend also validates authorization, clinical compatibility, source records and revisions.",
  "type": "object",
  "additionalProperties": false,
  "required": [
    "schemaVersion",
    "catalogVersion",
    "clinicId",
    "patientId",
    "chartId",
    "dentition",
    "numberingSystem",
    "chartVersion",
    "updatedAt",
    "updatedBy",
    "teeth"
  ],
  "properties": {
    "schemaVersion": {
      "const": 2
    },
    "catalogVersion": {
      "const": "fdi-v1"
    },
    "clinicId": {
      "type": "string",
      "minLength": 1,
      "maxLength": 128,
      "pattern": "^[A-Za-z0-9_-]+$"
    },
    "patientId": {
      "type": "string",
      "minLength": 1,
      "maxLength": 128,
      "pattern": "^[A-Za-z0-9_-]+$"
    },
    "chartId": {
      "type": "string",
      "minLength": 1,
      "maxLength": 128,
      "pattern": "^[A-Za-z0-9_-]+$"
    },
    "updatedBy": {
      "type": "string",
      "minLength": 1,
      "maxLength": 128,
      "pattern": "^[A-Za-z0-9_-]+$"
    },
    "dentition": {
      "enum": [
        "permanent",
        "primary",
        "mixed"
      ]
    },
    "numberingSystem": {
      "const": "FDI"
    },
    "chartVersion": {
      "type": "integer",
      "minimum": 0,
      "maximum": 2147483647
    },
    "updatedAt": {
      "type": "string",
      "format": "date-time",
      "pattern": "^\\d{4}-\\d{2}-\\d{2}T\\d{2}:\\d{2}:\\d{2}(\\.\\d{1,9})?Z$"
    },
    "teeth": {
      "type": "object",
      "maxProperties": 52,
      "propertyNames": {
        "enum": [
          "11",
          "12",
          "13",
          "14",
          "15",
          "16",
          "17",
          "18",
          "21",
          "22",
          "23",
          "24",
          "25",
          "26",
          "27",
          "28",
          "31",
          "32",
          "33",
          "34",
          "35",
          "36",
          "37",
          "38",
          "41",
          "42",
          "43",
          "44",
          "45",
          "46",
          "47",
          "48",
          "51",
          "52",
          "53",
          "54",
          "55",
          "61",
          "62",
          "63",
          "64",
          "65",
          "71",
          "72",
          "73",
          "74",
          "75",
          "81",
          "82",
          "83",
          "84",
          "85"
        ]
      },
      "additionalProperties": false,
      "patternProperties": {
        "^([1-4][1-3]|[5-8][1-3])$": {
          "properties": {
            "surfaces": {
              "propertyNames": {
                "enum": [
                  "M",
                  "D",
                  "F",
                  "L",
                  "I"
                ]
              }
            }
          },
          "$ref": "#/$defs/tooth"
        },
        "^([1-4][4-8]|[5-8][4-5])$": {
          "properties": {
            "surfaces": {
              "propertyNames": {
                "enum": [
                  "M",
                  "D",
                  "F",
                  "L",
                  "O"
                ]
              }
            }
          },
          "$ref": "#/$defs/tooth"
        }
      }
    }
  },
  "allOf": [
    {
      "if": {
        "properties": {
          "dentition": {
            "const": "permanent"
          }
        }
      },
      "then": {
        "properties": {
          "teeth": {
            "maxProperties": 32,
            "propertyNames": {
              "enum": [
                "11",
                "12",
                "13",
                "14",
                "15",
                "16",
                "17",
                "18",
                "21",
                "22",
                "23",
                "24",
                "25",
                "26",
                "27",
                "28",
                "31",
                "32",
                "33",
                "34",
                "35",
                "36",
                "37",
                "38",
                "41",
                "42",
                "43",
                "44",
                "45",
                "46",
                "47",
                "48"
              ]
            }
          }
        }
      }
    },
    {
      "if": {
        "properties": {
          "dentition": {
            "const": "primary"
          }
        }
      },
      "then": {
        "properties": {
          "teeth": {
            "maxProperties": 20,
            "propertyNames": {
              "enum": [
                "51",
                "52",
                "53",
                "54",
                "55",
                "61",
                "62",
                "63",
                "64",
                "65",
                "71",
                "72",
                "73",
                "74",
                "75",
                "81",
                "82",
                "83",
                "84",
                "85"
              ]
            }
          }
        }
      }
    }
  ],
  "$defs": {
    "tooth": {
      "type": "object",
      "additionalProperties": false,
      "required": [
        "assessment",
        "presence"
      ],
      "properties": {
        "assessment": {
          "enum": [
            "not_assessed",
            "assessed",
            "unable_to_assess"
          ]
        },
        "presence": {
          "enum": [
            "unknown",
            "present",
            "unerupted",
            "missing",
            "extracted",
            "exfoliated",
            "congenitally_absent"
          ]
        },
        "replacement": {
          "enum": [
            "none",
            "implant",
            "pontic",
            "removable_prosthesis"
          ]
        },
        "findings": {
          "type": "array",
          "items": {
            "enum": [
              "caries",
              "fracture",
              "wear",
              "endodontically_treated",
              "periapical_finding",
              "other"
            ]
          },
          "uniqueItems": true,
          "maxItems": 6
        },
        "surfaces": {
          "type": "object",
          "minProperties": 1,
          "maxProperties": 5,
          "additionalProperties": {
            "$ref": "#/$defs/surface"
          }
        },
        "treatmentStates": {
          "type": "array",
          "items": {
            "enum": [
              "planned",
              "accepted",
              "in_progress",
              "deferred",
              "referred"
            ]
          },
          "uniqueItems": true,
          "maxItems": 5
        }
      }
    },
    "surface": {
      "type": "object",
      "additionalProperties": false,
      "required": [
        "assessment",
        "findings",
        "restorations"
      ],
      "properties": {
        "assessment": {
          "enum": [
            "not_assessed",
            "assessed",
            "unable_to_assess"
          ]
        },
        "findings": {
          "type": "array",
          "items": {
            "enum": [
              "caries",
              "fracture",
              "wear",
              "endodontically_treated",
              "periapical_finding",
              "other"
            ]
          },
          "uniqueItems": true,
          "maxItems": 6
        },
        "restorations": {
          "type": "array",
          "items": {
            "enum": [
              "composite",
              "amalgam",
              "glass_ionomer",
              "sealant",
              "crown",
              "inlay",
              "onlay",
              "other"
            ]
          },
          "uniqueItems": true,
          "maxItems": 8
        }
      }
    }
  }
}
