{
  "schemaVersion": 2,
  "catalogVersion": "fdi-v1",
  "clinicId": "CLINIC-001",
  "patientId": "PAT-1001",
  "chartId": "CHART-1001",
  "dentition": "mixed",
  "numberingSystem": "FDI",
  "chartVersion": 7,
  "updatedAt": "2026-10-30T10:00:00Z",
  "updatedBy": "DOC-001",
  "teeth": {
    "11": {
      "assessment": "assessed",
      "presence": "unerupted"
    },
    "51": {
      "assessment": "assessed",
      "presence": "present"
    },
    "61": {
      "assessment": "assessed",
      "presence": "exfoliated"
    },
    "21": {
      "assessment": "assessed",
      "presence": "present"
    }
  }
}
